id|score|comment|bookId
724|2|volutpat in congue etiam justo etiam pretium iaculis justo in hac habitasse platea|730
725|1|in imperdiet et commodo vulputate justo in blandit ultrices enim lorem ipsum dolor sit amet consectetuer adipiscing elit|627
726|1|a feugiat et eros vestibulum ac est lacinia nisi venenatis tristique fusce congue diam id ornare imperdiet sapien|361
727|2|nec sem duis aliquam convallis nunc proin at turpis a pede posuere|25
728|1|vel nisl duis ac nibh fusce lacus purus aliquet at feugiat non pretium quis lectus suspendisse|171
729|4|sapien arcu sed augue aliquam erat volutpat in congue etiam justo etiam pretium iaculis justo|600
730|5|mauris eget massa tempor convallis nulla neque libero convallis eget eleifend luctus ultricies eu nibh quisque id justo sit amet|316
731|5|ipsum primis in faucibus orci luctus et ultrices posuere cubilia curae donec pharetra magna vestibulum|281
732|5|eget semper rutrum nulla nunc purus phasellus in felis donec|116
733|5|consectetuer adipiscing elit proin risus praesent lectus vestibulum quam sapien varius ut blandit non interdum|971
734|3|nunc donec quis orci eget orci vehicula condimentum curabitur in libero ut massa volutpat|908
735|4|id nisl venenatis lacinia aenean sit amet justo morbi ut odio|260
736|4|aenean auctor gravida sem praesent id massa id nisl venenatis lacinia aenean sit amet justo morbi|290
737|3|id ornare imperdiet sapien urna pretium nisl ut volutpat sapien arcu sed|755
738|4|sodales scelerisque mauris sit amet eros suspendisse accumsan tortor quis turpis sed ante vivamus tortor duis mattis egestas metus aenean|859
739|4|ultricies eu nibh quisque id justo sit amet sapien dignissim vestibulum vestibulum ante ipsum|211
740|1|sit amet turpis elementum ligula vehicula consequat morbi a ipsum integer a nibh in quis justo maecenas rhoncus aliquam lacus|926
741|3|lacinia erat vestibulum sed magna at nunc commodo placerat praesent blandit|65
742|4|sodales scelerisque mauris sit amet eros suspendisse accumsan tortor quis turpis|49
743|4|lacus purus aliquet at feugiat non pretium quis lectus suspendisse potenti in eleifend|341
744|2|ante vivamus tortor duis mattis egestas metus aenean fermentum donec ut mauris eget massa tempor|754
745|5|pede lobortis ligula sit amet eleifend pede libero quis orci nullam|825
746|1|eleifend luctus ultricies eu nibh quisque id justo sit amet sapien|531
747|2|congue elementum in hac habitasse platea dictumst morbi vestibulum velit id pretium iaculis diam erat fermentum justo nec|442
748|3|condimentum id luctus nec molestie sed justo pellentesque viverra pede ac diam cras pellentesque volutpat dui maecenas tristique|112
749|1|ultricies eu nibh quisque id justo sit amet sapien dignissim vestibulum vestibulum ante ipsum|521
750|2|nec molestie sed justo pellentesque viverra pede ac diam cras pellentesque volutpat dui maecenas tristique est et|262
751|5|lectus in est risus auctor sed tristique in tempus sit amet|307
752|4|felis fusce posuere felis sed lacus morbi sem mauris laoreet ut rhoncus aliquet pulvinar sed nisl nunc|705
753|4|aliquam non mauris morbi non lectus aliquam sit amet diam in|466
754|1|justo lacinia eget tincidunt eget tempus vel pede morbi porttitor lorem id ligula suspendisse ornare consequat lectus in est risus|558
755|3|vestibulum sed magna at nunc commodo placerat praesent blandit nam nulla integer pede justo lacinia eget tincidunt|597
756|2|ultrices posuere cubilia curae donec pharetra magna vestibulum aliquet ultrices erat tortor sollicitudin mi sit amet lobortis sapien sapien non|374
757|5|aenean sit amet justo morbi ut odio cras mi pede malesuada in imperdiet et commodo|487
758|2|libero nullam sit amet turpis elementum ligula vehicula consequat morbi a ipsum integer a nibh in quis justo|412
759|2|convallis nulla neque libero convallis eget eleifend luctus ultricies eu nibh quisque id justo sit|166
760|1|sapien a libero nam dui proin leo odio porttitor id consequat|622
761|3|magnis dis parturient montes nascetur ridiculus mus vivamus vestibulum sagittis sapien cum sociis natoque penatibus|66
762|4|nulla eget eros elementum pellentesque quisque porta volutpat erat quisque erat eros viverra eget congue eget|178
763|1|posuere metus vitae ipsum aliquam non mauris morbi non lectus aliquam sit amet diam in magna|938
764|1|justo in blandit ultrices enim lorem ipsum dolor sit amet consectetuer adipiscing|733
765|1|duis faucibus accumsan odio curabitur convallis duis consequat dui nec nisi|237
766|3|leo rhoncus sed vestibulum sit amet cursus id turpis integer aliquet massa id lobortis convallis tortor risus dapibus|737
767|2|quisque arcu libero rutrum ac lobortis vel dapibus at diam nam tristique tortor eu|689
768|1|magnis dis parturient montes nascetur ridiculus mus vivamus vestibulum sagittis sapien cum sociis natoque|174
769|2|pellentesque ultrices mattis odio donec vitae nisi nam ultrices libero non mattis pulvinar nulla pede ullamcorper augue|747
770|5|sapien placerat ante nulla justo aliquam quis turpis eget elit sodales scelerisque mauris sit amet eros|748
771|4|quam turpis adipiscing lorem vitae mattis nibh ligula nec sem duis aliquam convallis nunc proin at turpis|225
772|2|orci luctus et ultrices posuere cubilia curae duis faucibus accumsan odio curabitur convallis duis consequat|308
773|4|tortor quis turpis sed ante vivamus tortor duis mattis egestas metus aenean fermentum donec ut mauris eget massa|542
774|1|orci luctus et ultrices posuere cubilia curae nulla dapibus dolor vel est donec odio justo sollicitudin ut suscipit|257
775|2|pretium nisl ut volutpat sapien arcu sed augue aliquam erat volutpat in congue etiam justo etiam pretium iaculis|227
776|2|congue risus semper porta volutpat quam pede lobortis ligula sit amet eleifend pede libero quis orci nullam molestie nibh in|368
777|1|et ultrices posuere cubilia curae duis faucibus accumsan odio curabitur convallis duis consequat dui nec nisi volutpat|500
778|3|aliquam quis turpis eget elit sodales scelerisque mauris sit amet eros suspendisse accumsan tortor|997
779|5|quam turpis adipiscing lorem vitae mattis nibh ligula nec sem duis|99
780|2|nullam sit amet turpis elementum ligula vehicula consequat morbi a ipsum integer a nibh|909
781|4|ligula in lacus curabitur at ipsum ac tellus semper interdum mauris|90
782|5|libero ut massa volutpat convallis morbi odio odio elementum eu|147
783|3|vestibulum sagittis sapien cum sociis natoque penatibus et magnis dis parturient montes nascetur ridiculus|361
784|5|nam congue risus semper porta volutpat quam pede lobortis ligula|770
785|4|nisi eu orci mauris lacinia sapien quis libero nullam sit amet|577
786|1|imperdiet et commodo vulputate justo in blandit ultrices enim lorem ipsum dolor sit amet consectetuer adipiscing|623
787|5|non lectus aliquam sit amet diam in magna bibendum imperdiet nullam orci pede venenatis non sodales sed tincidunt eu|757
788|2|maecenas leo odio condimentum id luctus nec molestie sed justo pellentesque viverra pede ac diam cras pellentesque|982
789|4|vel nulla eget eros elementum pellentesque quisque porta volutpat erat quisque erat eros viverra eget congue eget semper|978
790|1|fusce posuere felis sed lacus morbi sem mauris laoreet ut rhoncus aliquet pulvinar sed nisl|919
791|1|aliquam convallis nunc proin at turpis a pede posuere nonummy integer non velit donec diam neque vestibulum eget vulputate|494
792|3|faucibus orci luctus et ultrices posuere cubilia curae mauris viverra diam vitae quam|736
793|4|eget rutrum at lorem integer tincidunt ante vel ipsum praesent blandit lacinia erat vestibulum sed magna at|706
794|5|in lacus curabitur at ipsum ac tellus semper interdum mauris ullamcorper purus sit amet|21
795|1|ultrices posuere cubilia curae nulla dapibus dolor vel est donec odio justo sollicitudin ut suscipit a|473
796|5|tincidunt nulla mollis molestie lorem quisque ut erat curabitur gravida nisi|70
797|3|morbi porttitor lorem id ligula suspendisse ornare consequat lectus in est risus auctor sed|183
798|1|ipsum integer a nibh in quis justo maecenas rhoncus aliquam lacus morbi|777
799|3|venenatis lacinia aenean sit amet justo morbi ut odio cras|958
800|3|ultrices vel augue vestibulum ante ipsum primis in faucibus orci luctus et ultrices posuere cubilia curae|994
801|5|ridiculus mus etiam vel augue vestibulum rutrum rutrum neque aenean|881
802|1|rhoncus aliquet pulvinar sed nisl nunc rhoncus dui vel sem sed sagittis nam congue risus semper porta|512
803|3|porttitor id consequat in consequat ut nulla sed accumsan felis ut at dolor quis odio consequat|729
804|1|phasellus in felis donec semper sapien a libero nam dui proin leo odio porttitor id consequat in|966
805|5|tristique in tempus sit amet sem fusce consequat nulla nisl nunc nisl duis bibendum felis sed interdum venenatis|913
806|1|vel est donec odio justo sollicitudin ut suscipit a feugiat et|149
807|3|in purus eu magna vulputate luctus cum sociis natoque penatibus et|931
808|3|cum sociis natoque penatibus et magnis dis parturient montes nascetur ridiculus mus|879
809|3|ante vivamus tortor duis mattis egestas metus aenean fermentum donec|392
810|4|amet cursus id turpis integer aliquet massa id lobortis convallis tortor risus dapibus augue vel accumsan tellus nisi eu orci|454
811|1|justo aliquam quis turpis eget elit sodales scelerisque mauris sit amet eros suspendisse accumsan tortor|265
812|4|dis parturient montes nascetur ridiculus mus vivamus vestibulum sagittis sapien cum sociis|711
813|3|amet justo morbi ut odio cras mi pede malesuada in|313
814|2|aliquam convallis nunc proin at turpis a pede posuere nonummy integer|506
815|3|a pede posuere nonummy integer non velit donec diam neque vestibulum eget|697
816|3|elementum pellentesque quisque porta volutpat erat quisque erat eros viverra eget congue eget semper rutrum nulla nunc|400
817|1|primis in faucibus orci luctus et ultrices posuere cubilia curae donec|401
818|5|eget tempus vel pede morbi porttitor lorem id ligula suspendisse ornare consequat lectus|117
819|3|felis donec semper sapien a libero nam dui proin leo|242
820|1|justo maecenas rhoncus aliquam lacus morbi quis tortor id nulla ultrices|251
821|3|congue elementum in hac habitasse platea dictumst morbi vestibulum velit|555
822|5|libero nullam sit amet turpis elementum ligula vehicula consequat morbi a ipsum integer a nibh in quis justo maecenas|450
823|5|morbi sem mauris laoreet ut rhoncus aliquet pulvinar sed nisl|347
824|4|in magna bibendum imperdiet nullam orci pede venenatis non sodales|579
825|5|id lobortis convallis tortor risus dapibus augue vel accumsan tellus|667
826|3|blandit nam nulla integer pede justo lacinia eget tincidunt eget tempus|147
827|4|phasellus id sapien in sapien iaculis congue vivamus metus arcu adipiscing molestie hendrerit at vulputate vitae nisl|522
828|5|ac nibh fusce lacus purus aliquet at feugiat non pretium quis lectus suspendisse potenti in eleifend quam|51
829|3|ultrices aliquet maecenas leo odio condimentum id luctus nec molestie sed justo pellentesque|102
830|2|in quis justo maecenas rhoncus aliquam lacus morbi quis tortor id nulla ultrices aliquet maecenas leo odio|353
831|1|nonummy maecenas tincidunt lacus at velit vivamus vel nulla eget eros elementum pellentesque quisque|523
832|1|nulla tellus in sagittis dui vel nisl duis ac nibh fusce lacus purus aliquet at feugiat non pretium quis lectus|436
833|1|vulputate vitae nisl aenean lectus pellentesque eget nunc donec quis orci eget orci vehicula condimentum|760
834|3|quis tortor id nulla ultrices aliquet maecenas leo odio condimentum|107
835|5|posuere nonummy integer non velit donec diam neque vestibulum eget vulputate ut ultrices|663
836|4|pede posuere nonummy integer non velit donec diam neque vestibulum eget vulputate ut ultrices vel augue vestibulum|742
837|5|morbi non quam nec dui luctus rutrum nulla tellus in sagittis dui vel|40
838|3|curabitur in libero ut massa volutpat convallis morbi odio odio elementum eu|747
839|2|vestibulum ante ipsum primis in faucibus orci luctus et ultrices posuere cubilia|213
840|2|nisl ut volutpat sapien arcu sed augue aliquam erat volutpat in congue etiam justo etiam pretium iaculis justo|482
841|4|id nisl venenatis lacinia aenean sit amet justo morbi ut odio cras mi pede malesuada in imperdiet et|989
842|5|volutpat quam pede lobortis ligula sit amet eleifend pede libero quis orci nullam molestie nibh in lectus|975
843|3|sociis natoque penatibus et magnis dis parturient montes nascetur ridiculus|360
844|3|in libero ut massa volutpat convallis morbi odio odio elementum eu interdum eu tincidunt in leo|904
845|1|molestie lorem quisque ut erat curabitur gravida nisi at nibh in hac habitasse platea dictumst aliquam augue|523
846|1|volutpat dui maecenas tristique est et tempus semper est quam pharetra magna ac consequat metus sapien ut|337
847|1|massa id lobortis convallis tortor risus dapibus augue vel accumsan tellus nisi eu orci mauris lacinia sapien quis|423
848|4|nisi vulputate nonummy maecenas tincidunt lacus at velit vivamus vel nulla eget eros|47
849|2|nisi vulputate nonummy maecenas tincidunt lacus at velit vivamus vel nulla eget eros elementum pellentesque|984
850|2|tincidunt in leo maecenas pulvinar lobortis est phasellus sit amet erat nulla tempus vivamus in felis eu sapien|492
851|4|sed justo pellentesque viverra pede ac diam cras pellentesque volutpat dui maecenas tristique est et tempus semper est quam pharetra|116
852|2|risus praesent lectus vestibulum quam sapien varius ut blandit non interdum in ante vestibulum ante ipsum|196
853|5|proin leo odio porttitor id consequat in consequat ut nulla sed accumsan felis|319
854|5|elementum eu interdum eu tincidunt in leo maecenas pulvinar lobortis est phasellus sit amet erat nulla tempus vivamus in felis|309
855|3|lorem ipsum dolor sit amet consectetuer adipiscing elit proin risus|773
856|4|varius ut blandit non interdum in ante vestibulum ante ipsum primis in faucibus orci luctus|529
857|4|ut volutpat sapien arcu sed augue aliquam erat volutpat in congue etiam justo etiam pretium|817
858|4|ante ipsum primis in faucibus orci luctus et ultrices posuere cubilia curae donec pharetra magna|45
859|3|ut massa quis augue luctus tincidunt nulla mollis molestie lorem quisque ut erat curabitur gravida nisi at nibh|719
860|2|odio cras mi pede malesuada in imperdiet et commodo vulputate justo in blandit ultrices enim lorem|205
861|3|phasellus id sapien in sapien iaculis congue vivamus metus arcu adipiscing molestie hendrerit at vulputate vitae nisl aenean lectus|450
862|5|aenean sit amet justo morbi ut odio cras mi pede malesuada in imperdiet et commodo vulputate justo in blandit|515
863|2|eu interdum eu tincidunt in leo maecenas pulvinar lobortis est phasellus sit amet erat|249
864|1|nulla nisl nunc nisl duis bibendum felis sed interdum venenatis turpis enim blandit mi in porttitor pede justo|677
865|5|donec semper sapien a libero nam dui proin leo odio porttitor id consequat in consequat ut nulla|640
866|5|duis faucibus accumsan odio curabitur convallis duis consequat dui nec nisi volutpat eleifend donec ut dolor morbi vel lectus|785
867|5|est et tempus semper est quam pharetra magna ac consequat metus sapien ut nunc vestibulum ante ipsum primis in faucibus|224
868|4|integer ac leo pellentesque ultrices mattis odio donec vitae nisi nam ultrices libero non mattis pulvinar nulla pede ullamcorper|403
869|1|ut nulla sed accumsan felis ut at dolor quis odio consequat varius integer ac leo pellentesque ultrices mattis|919
870|2|neque duis bibendum morbi non quam nec dui luctus rutrum nulla tellus in sagittis dui vel nisl duis ac|850
871|1|metus arcu adipiscing molestie hendrerit at vulputate vitae nisl aenean lectus pellentesque eget nunc|575
872|3|suspendisse potenti nullam porttitor lacus at turpis donec posuere metus vitae ipsum aliquam non mauris morbi non lectus aliquam sit|375
873|3|id turpis integer aliquet massa id lobortis convallis tortor risus dapibus|125
874|3|nec sem duis aliquam convallis nunc proin at turpis a pede posuere nonummy integer non velit donec diam neque vestibulum|876
875|5|lobortis est phasellus sit amet erat nulla tempus vivamus in felis eu sapien cursus vestibulum proin eu|932
876|3|eu mi nulla ac enim in tempor turpis nec euismod scelerisque quam turpis adipiscing lorem vitae mattis nibh|935
877|1|justo sollicitudin ut suscipit a feugiat et eros vestibulum ac est|211
878|5|morbi vestibulum velit id pretium iaculis diam erat fermentum justo nec condimentum|117
879|2|magna ac consequat metus sapien ut nunc vestibulum ante ipsum primis in faucibus orci luctus et ultrices|92
880|4|fusce posuere felis sed lacus morbi sem mauris laoreet ut rhoncus aliquet pulvinar sed nisl nunc rhoncus dui|70
881|5|nulla mollis molestie lorem quisque ut erat curabitur gravida nisi at nibh in hac habitasse platea|210
882|5|pulvinar sed nisl nunc rhoncus dui vel sem sed sagittis|828
883|5|vivamus vestibulum sagittis sapien cum sociis natoque penatibus et magnis dis parturient montes nascetur ridiculus mus etiam|864
884|1|purus sit amet nulla quisque arcu libero rutrum ac lobortis vel dapibus at diam nam|180
885|1|nibh fusce lacus purus aliquet at feugiat non pretium quis lectus suspendisse potenti in eleifend quam|974
886|2|sed tristique in tempus sit amet sem fusce consequat nulla nisl|710
887|5|orci vehicula condimentum curabitur in libero ut massa volutpat convallis morbi odio odio|190
888|1|cras pellentesque volutpat dui maecenas tristique est et tempus semper est quam pharetra magna|311
889|1|rutrum nulla tellus in sagittis dui vel nisl duis ac nibh fusce lacus purus aliquet|512
890|5|venenatis non sodales sed tincidunt eu felis fusce posuere felis sed lacus morbi sem mauris laoreet ut|631
891|3|adipiscing elit proin risus praesent lectus vestibulum quam sapien varius ut blandit non|275
892|1|ipsum integer a nibh in quis justo maecenas rhoncus aliquam lacus morbi quis tortor id nulla ultrices aliquet maecenas|979
893|3|nec condimentum neque sapien placerat ante nulla justo aliquam quis turpis eget elit sodales scelerisque mauris sit amet|834
894|5|felis eu sapien cursus vestibulum proin eu mi nulla ac enim in tempor|278
895|3|pharetra magna vestibulum aliquet ultrices erat tortor sollicitudin mi sit amet lobortis sapien sapien non mi|591
896|1|quam pede lobortis ligula sit amet eleifend pede libero quis orci nullam molestie nibh in lectus pellentesque|771
897|5|cras mi pede malesuada in imperdiet et commodo vulputate justo in|268
898|1|platea dictumst maecenas ut massa quis augue luctus tincidunt nulla|106
899|4|viverra dapibus nulla suscipit ligula in lacus curabitur at ipsum ac tellus semper|895
900|5|venenatis non sodales sed tincidunt eu felis fusce posuere felis sed lacus morbi sem mauris laoreet ut rhoncus|399
901|3|proin leo odio porttitor id consequat in consequat ut nulla sed|943
902|4|in quam fringilla rhoncus mauris enim leo rhoncus sed vestibulum sit amet cursus id turpis integer aliquet|13
903|5|et ultrices posuere cubilia curae mauris viverra diam vitae quam suspendisse|425
904|1|nibh in lectus pellentesque at nulla suspendisse potenti cras in purus eu magna vulputate luctus|103
905|2|at turpis a pede posuere nonummy integer non velit donec diam neque vestibulum eget|485
906|3|velit donec diam neque vestibulum eget vulputate ut ultrices vel augue vestibulum|123
907|3|eleifend donec ut dolor morbi vel lectus in quam fringilla rhoncus mauris enim leo|548
908|2|id massa id nisl venenatis lacinia aenean sit amet justo morbi ut odio cras mi pede malesuada in|783
909|1|est quam pharetra magna ac consequat metus sapien ut nunc vestibulum ante ipsum primis in faucibus orci luctus|277
910|3|quam turpis adipiscing lorem vitae mattis nibh ligula nec sem duis aliquam convallis nunc proin at turpis a pede posuere|862
911|3|vestibulum proin eu mi nulla ac enim in tempor turpis nec euismod scelerisque|729
912|4|posuere metus vitae ipsum aliquam non mauris morbi non lectus aliquam sit amet diam in|676
913|1|et ultrices posuere cubilia curae donec pharetra magna vestibulum aliquet ultrices erat tortor|979
914|3|parturient montes nascetur ridiculus mus vivamus vestibulum sagittis sapien cum sociis natoque penatibus et magnis dis|614
915|5|tempor convallis nulla neque libero convallis eget eleifend luctus ultricies eu nibh quisque id justo sit amet sapien|537
916|4|vestibulum sed magna at nunc commodo placerat praesent blandit nam nulla integer pede justo lacinia|871
917|3|pellentesque quisque porta volutpat erat quisque erat eros viverra eget congue eget semper rutrum nulla nunc purus phasellus in felis|547
918|1|consequat ut nulla sed accumsan felis ut at dolor quis odio consequat varius integer ac|761
919|4|in sapien iaculis congue vivamus metus arcu adipiscing molestie hendrerit at vulputate vitae nisl aenean lectus pellentesque eget nunc donec|159
920|5|arcu sed augue aliquam erat volutpat in congue etiam justo etiam pretium iaculis justo in hac habitasse platea dictumst etiam|234
921|3|pede venenatis non sodales sed tincidunt eu felis fusce posuere felis sed lacus morbi sem mauris laoreet ut rhoncus aliquet|836
922|2|velit eu est congue elementum in hac habitasse platea dictumst|376
923|4|erat eros viverra eget congue eget semper rutrum nulla nunc purus phasellus in felis donec semper sapien|89
924|1|imperdiet et commodo vulputate justo in blandit ultrices enim lorem ipsum dolor sit amet consectetuer adipiscing elit proin interdum mauris|317
925|3|nisl nunc rhoncus dui vel sem sed sagittis nam congue risus semper porta volutpat quam pede lobortis ligula|879
926|1|convallis morbi odio odio elementum eu interdum eu tincidunt in leo|929
927|3|congue elementum in hac habitasse platea dictumst morbi vestibulum velit id pretium iaculis diam erat fermentum|319
928|4|ullamcorper augue a suscipit nulla elit ac nulla sed vel enim sit amet nunc viverra dapibus nulla|910
929|4|rhoncus aliquet pulvinar sed nisl nunc rhoncus dui vel sem sed sagittis nam congue risus semper|157
930|2|duis ac nibh fusce lacus purus aliquet at feugiat non pretium quis lectus suspendisse potenti in eleifend quam a|807
931|5|est et tempus semper est quam pharetra magna ac consequat|369
932|5|eu interdum eu tincidunt in leo maecenas pulvinar lobortis est|704
933|5|mattis pulvinar nulla pede ullamcorper augue a suscipit nulla elit ac nulla sed vel|980
934|2|id sapien in sapien iaculis congue vivamus metus arcu adipiscing molestie hendrerit at|631
935|4|nam dui proin leo odio porttitor id consequat in consequat ut nulla sed|269
936|5|pede ac diam cras pellentesque volutpat dui maecenas tristique est et tempus semper est quam pharetra magna ac|379
937|1|lacinia aenean sit amet justo morbi ut odio cras mi pede malesuada in imperdiet et|200
938|2|eget eleifend luctus ultricies eu nibh quisque id justo sit amet sapien|180
939|4|in faucibus orci luctus et ultrices posuere cubilia curae duis faucibus accumsan odio|699
940|1|nunc commodo placerat praesent blandit nam nulla integer pede justo lacinia|268
941|4|ligula nec sem duis aliquam convallis nunc proin at turpis a pede posuere|809
942|4|nisl nunc rhoncus dui vel sem sed sagittis nam congue risus semper porta volutpat quam|376
943|2|pretium iaculis diam erat fermentum justo nec condimentum neque sapien placerat ante nulla justo aliquam quis|491
944|1|vivamus vel nulla eget eros elementum pellentesque quisque porta volutpat erat quisque erat eros viverra eget congue|634
945|3|tristique fusce congue diam id ornare imperdiet sapien urna pretium nisl ut volutpat sapien arcu sed|906
946|3|ante ipsum primis in faucibus orci luctus et ultrices posuere cubilia curae duis faucibus accumsan odio curabitur|254
947|4|nullam varius nulla facilisi cras non velit nec nisi vulputate|430
948|1|congue diam id ornare imperdiet sapien urna pretium nisl ut volutpat sapien arcu sed|565
949|2|adipiscing lorem vitae mattis nibh ligula nec sem duis aliquam convallis nunc|448
950|3|quis turpis sed ante vivamus tortor duis mattis egestas metus aenean fermentum donec ut mauris eget massa|600
951|2|gravida nisi at nibh in hac habitasse platea dictumst aliquam augue quam|386
952|4|facilisi cras non velit nec nisi vulputate nonummy maecenas tincidunt lacus at velit vivamus vel nulla eget|902
953|2|nulla facilisi cras non velit nec nisi vulputate nonummy maecenas tincidunt lacus at velit|570
954|4|odio porttitor id consequat in consequat ut nulla sed accumsan felis|102
955|3|condimentum neque sapien placerat ante nulla justo aliquam quis turpis eget elit sodales scelerisque mauris sit amet eros suspendisse accumsan|870
956|1|ac est lacinia nisi venenatis tristique fusce congue diam id ornare|796
957|5|aliquam sit amet diam in magna bibendum imperdiet nullam orci pede venenatis non sodales sed tincidunt|526
958|3|rutrum nulla tellus in sagittis dui vel nisl duis ac nibh fusce lacus purus|766
959|4|rutrum nulla nunc purus phasellus in felis donec semper sapien a libero nam dui proin leo odio porttitor id|113
960|2|tellus nulla ut erat id mauris vulputate elementum nullam varius nulla facilisi cras|989
961|2|sapien sapien non mi integer ac neque duis bibendum morbi non quam nec dui|282
962|3|justo in blandit ultrices enim lorem ipsum dolor sit amet consectetuer adipiscing elit proin interdum|127
963|2|in blandit ultrices enim lorem ipsum dolor sit amet consectetuer adipiscing elit proin interdum|130
964|1|consectetuer adipiscing elit proin risus praesent lectus vestibulum quam sapien varius ut blandit non interdum in ante|805
965|3|aliquam sit amet diam in magna bibendum imperdiet nullam orci pede venenatis non|276
966|2|luctus et ultrices posuere cubilia curae donec pharetra magna vestibulum aliquet|107
967|4|maecenas tincidunt lacus at velit vivamus vel nulla eget eros|100
968|3|dignissim vestibulum vestibulum ante ipsum primis in faucibus orci luctus et ultrices|717
969|3|duis ac nibh fusce lacus purus aliquet at feugiat non pretium quis lectus suspendisse potenti in eleifend quam a|666
