id|score|comment|bookId
246|2|at velit eu est congue elementum in hac habitasse platea|276
247|4|dolor morbi vel lectus in quam fringilla rhoncus mauris enim leo rhoncus sed vestibulum sit amet cursus|801
248|2|vulputate luctus cum sociis natoque penatibus et magnis dis parturient montes nascetur ridiculus mus vivamus vestibulum sagittis sapien cum sociis|210
249|2|ridiculus mus etiam vel augue vestibulum rutrum rutrum neque aenean auctor|142
250|2|curae nulla dapibus dolor vel est donec odio justo sollicitudin ut suscipit a feugiat et eros vestibulum ac est lacinia|345
251|4|sit amet nulla quisque arcu libero rutrum ac lobortis vel dapibus|544
252|4|interdum venenatis turpis enim blandit mi in porttitor pede justo eu massa donec dapibus duis at velit eu est|580
253|4|ultrices vel augue vestibulum ante ipsum primis in faucibus orci luctus et ultrices posuere cubilia curae donec pharetra|834
254|5|nec molestie sed justo pellentesque viverra pede ac diam cras pellentesque volutpat dui maecenas tristique est et|110
255|4|vel augue vestibulum rutrum rutrum neque aenean auctor gravida sem praesent id massa|487
256|2|in hac habitasse platea dictumst maecenas ut massa quis augue luctus|781
257|5|habitasse platea dictumst aliquam augue quam sollicitudin vitae consectetuer eget rutrum at lorem integer tincidunt ante vel ipsum|894
258|5|magna ac consequat metus sapien ut nunc vestibulum ante ipsum primis in faucibus orci luctus|655
259|4|pede posuere nonummy integer non velit donec diam neque vestibulum eget vulputate ut ultrices vel augue vestibulum ante|319
260|2|sapien ut nunc vestibulum ante ipsum primis in faucibus orci luctus et ultrices posuere cubilia curae mauris viverra diam|681
261|5|ut blandit non interdum in ante vestibulum ante ipsum primis in faucibus orci luctus et ultrices|568
262|2|pretium iaculis diam erat fermentum justo nec condimentum neque sapien placerat ante nulla justo aliquam|726
263|2|justo nec condimentum neque sapien placerat ante nulla justo aliquam quis turpis eget elit sodales scelerisque mauris sit amet|360
264|5|mauris non ligula pellentesque ultrices phasellus id sapien in sapien iaculis congue vivamus metus arcu adipiscing molestie hendrerit at vulputate|81
265|1|faucibus cursus urna ut tellus nulla ut erat id mauris vulputate elementum nullam varius nulla facilisi cras non velit nec|185
266|4|scelerisque quam turpis adipiscing lorem vitae mattis nibh ligula nec sem duis aliquam convallis nunc|43
267|1|molestie nibh in lectus pellentesque at nulla suspendisse potenti cras in purus eu magna vulputate luctus cum sociis natoque penatibus|91
268|3|neque libero convallis eget eleifend luctus ultricies eu nibh quisque id justo sit amet|591
269|4|eros vestibulum ac est lacinia nisi venenatis tristique fusce congue diam id ornare imperdiet|720
270|1|sapien arcu sed augue aliquam erat volutpat in congue etiam justo etiam pretium iaculis justo in hac|574
271|3|parturient montes nascetur ridiculus mus etiam vel augue vestibulum rutrum rutrum|442
272|1|maecenas tristique est et tempus semper est quam pharetra magna ac consequat metus sapien ut nunc vestibulum ante ipsum primis|866
273|3|phasellus in felis donec semper sapien a libero nam dui proin leo|276
274|4|amet consectetuer adipiscing elit proin interdum mauris non ligula pellentesque ultrices phasellus id sapien in sapien iaculis|644
275|3|morbi vestibulum velit id pretium iaculis diam erat fermentum justo nec condimentum neque sapien placerat|456
276|4|ligula sit amet eleifend pede libero quis orci nullam molestie nibh in lectus|858
277|2|nam congue risus semper porta volutpat quam pede lobortis ligula sit amet eleifend pede libero quis orci nullam|385
278|3|id massa id nisl venenatis lacinia aenean sit amet justo morbi ut odio cras mi pede malesuada in|96
279|5|turpis donec posuere metus vitae ipsum aliquam non mauris morbi non|131
280|5|auctor sed tristique in tempus sit amet sem fusce consequat nulla nisl nunc nisl duis bibendum|942
281|2|bibendum morbi non quam nec dui luctus rutrum nulla tellus in sagittis dui vel nisl duis ac nibh fusce lacus|550
282|5|phasellus sit amet erat nulla tempus vivamus in felis eu sapien cursus vestibulum|378
283|5|mauris viverra diam vitae quam suspendisse potenti nullam porttitor lacus at turpis|581
284|5|in faucibus orci luctus et ultrices posuere cubilia curae donec|460
285|4|ultrices aliquet maecenas leo odio condimentum id luctus nec molestie sed justo pellentesque viverra|825
286|5|in blandit ultrices enim lorem ipsum dolor sit amet consectetuer adipiscing elit proin interdum|722
287|5|odio in hac habitasse platea dictumst maecenas ut massa quis augue luctus tincidunt|307
288|2|fusce lacus purus aliquet at feugiat non pretium quis lectus suspendisse potenti in|668
289|2|diam erat fermentum justo nec condimentum neque sapien placerat ante nulla justo aliquam quis turpis eget elit sodales scelerisque mauris|330
290|3|congue diam id ornare imperdiet sapien urna pretium nisl ut volutpat sapien|666
291|2|dui proin leo odio porttitor id consequat in consequat ut nulla sed accumsan felis ut at dolor quis|777
292|4|posuere cubilia curae donec pharetra magna vestibulum aliquet ultrices erat tortor sollicitudin mi sit amet lobortis|914
293|2|amet eros suspendisse accumsan tortor quis turpis sed ante vivamus tortor duis mattis egestas metus|901
294|5|eget congue eget semper rutrum nulla nunc purus phasellus in felis donec|172
295|4|quis augue luctus tincidunt nulla mollis molestie lorem quisque ut erat curabitur gravida nisi at nibh in hac habitasse|993
296|2|porta volutpat quam pede lobortis ligula sit amet eleifend pede|324
297|4|dui vel nisl duis ac nibh fusce lacus purus aliquet at feugiat|862
298|4|justo lacinia eget tincidunt eget tempus vel pede morbi porttitor lorem id ligula suspendisse ornare consequat lectus in est risus|362
299|3|pellentesque quisque porta volutpat erat quisque erat eros viverra eget congue eget semper rutrum nulla nunc purus phasellus in felis|293
300|1|eget nunc donec quis orci eget orci vehicula condimentum curabitur in libero ut massa volutpat convallis|758
301|5|ac tellus semper interdum mauris ullamcorper purus sit amet nulla quisque arcu libero rutrum ac lobortis vel|462
302|3|in lectus pellentesque at nulla suspendisse potenti cras in purus eu magna|781
303|4|vulputate nonummy maecenas tincidunt lacus at velit vivamus vel nulla|542
304|2|aenean lectus pellentesque eget nunc donec quis orci eget orci vehicula condimentum curabitur in libero ut massa|633
305|3|in tempor turpis nec euismod scelerisque quam turpis adipiscing lorem vitae mattis nibh ligula nec sem duis|314
306|2|libero nam dui proin leo odio porttitor id consequat in consequat ut nulla sed|145
307|5|sit amet nunc viverra dapibus nulla suscipit ligula in lacus curabitur at ipsum ac tellus semper interdum mauris|411
308|4|id turpis integer aliquet massa id lobortis convallis tortor risus dapibus augue|444
309|3|aliquam quis turpis eget elit sodales scelerisque mauris sit amet eros suspendisse accumsan tortor quis turpis|834
310|4|in leo maecenas pulvinar lobortis est phasellus sit amet erat nulla tempus vivamus in felis eu sapien cursus vestibulum proin|360
311|1|sit amet nunc viverra dapibus nulla suscipit ligula in lacus curabitur at ipsum ac tellus semper interdum mauris ullamcorper purus|492
312|3|praesent blandit nam nulla integer pede justo lacinia eget tincidunt|235
313|2|nulla nunc purus phasellus in felis donec semper sapien a libero nam dui proin leo odio porttitor id|224
314|4|sed magna at nunc commodo placerat praesent blandit nam nulla integer pede justo lacinia|849
315|3|metus arcu adipiscing molestie hendrerit at vulputate vitae nisl aenean lectus pellentesque eget nunc donec quis orci eget|156
316|2|aliquam non mauris morbi non lectus aliquam sit amet diam in magna bibendum imperdiet nullam orci|822
317|3|curae nulla dapibus dolor vel est donec odio justo sollicitudin ut suscipit a feugiat et|282
318|1|vivamus metus arcu adipiscing molestie hendrerit at vulputate vitae nisl aenean lectus pellentesque eget nunc donec quis|507
319|4|felis ut at dolor quis odio consequat varius integer ac leo|631
320|4|nulla suscipit ligula in lacus curabitur at ipsum ac tellus semper interdum mauris|852
321|3|sapien cursus vestibulum proin eu mi nulla ac enim in tempor turpis nec euismod scelerisque quam|613
322|3|convallis morbi odio odio elementum eu interdum eu tincidunt in|269
323|1|id consequat in consequat ut nulla sed accumsan felis ut|850
324|4|quis odio consequat varius integer ac leo pellentesque ultrices mattis odio donec|507
325|2|primis in faucibus orci luctus et ultrices posuere cubilia curae duis faucibus accumsan odio curabitur|988
326|1|vulputate luctus cum sociis natoque penatibus et magnis dis parturient montes nascetur ridiculus mus vivamus|110
327|4|vitae mattis nibh ligula nec sem duis aliquam convallis nunc proin at turpis a pede posuere nonummy integer non velit|86
328|1|nam ultrices libero non mattis pulvinar nulla pede ullamcorper augue a suscipit nulla elit ac nulla|315
329|3|eget tincidunt eget tempus vel pede morbi porttitor lorem id|440
330|4|vestibulum proin eu mi nulla ac enim in tempor turpis nec euismod scelerisque|463
331|3|luctus cum sociis natoque penatibus et magnis dis parturient montes nascetur ridiculus mus vivamus|749
332|1|vel nulla eget eros elementum pellentesque quisque porta volutpat erat quisque erat eros viverra|687
333|4|maecenas pulvinar lobortis est phasellus sit amet erat nulla tempus vivamus in felis eu sapien|717
334|5|mauris vulputate elementum nullam varius nulla facilisi cras non velit nec nisi|346
335|4|id mauris vulputate elementum nullam varius nulla facilisi cras non velit nec nisi vulputate|563
336|1|semper rutrum nulla nunc purus phasellus in felis donec semper sapien a|320
337|2|turpis eget elit sodales scelerisque mauris sit amet eros suspendisse accumsan tortor quis turpis sed ante vivamus|80
338|5|vestibulum sed magna at nunc commodo placerat praesent blandit nam nulla integer pede justo lacinia eget|888
339|1|consequat nulla nisl nunc nisl duis bibendum felis sed interdum|851
340|4|libero non mattis pulvinar nulla pede ullamcorper augue a suscipit nulla elit ac nulla sed vel enim sit|798
341|5|consequat varius integer ac leo pellentesque ultrices mattis odio donec vitae nisi nam ultrices libero non mattis pulvinar nulla|179
342|2|sed accumsan felis ut at dolor quis odio consequat varius integer ac leo pellentesque ultrices mattis odio donec vitae|460
343|4|vestibulum velit id pretium iaculis diam erat fermentum justo nec condimentum neque sapien placerat ante nulla justo|529
344|5|at nunc commodo placerat praesent blandit nam nulla integer pede justo lacinia eget tincidunt eget tempus vel pede morbi|336
345|2|tempus vivamus in felis eu sapien cursus vestibulum proin eu mi nulla ac enim in|250
346|2|sapien cum sociis natoque penatibus et magnis dis parturient montes nascetur ridiculus mus etiam vel|548
347|3|est donec odio justo sollicitudin ut suscipit a feugiat et eros vestibulum|795
348|5|duis ac nibh fusce lacus purus aliquet at feugiat non pretium quis lectus suspendisse|349
349|4|diam vitae quam suspendisse potenti nullam porttitor lacus at turpis|820
350|4|erat id mauris vulputate elementum nullam varius nulla facilisi cras non velit nec nisi vulputate|129
351|2|justo lacinia eget tincidunt eget tempus vel pede morbi porttitor lorem id ligula suspendisse ornare consequat lectus in est risus|39
352|3|ligula nec sem duis aliquam convallis nunc proin at turpis a pede posuere nonummy integer non velit donec diam|73
353|1|ante ipsum primis in faucibus orci luctus et ultrices posuere cubilia curae mauris|301
354|2|potenti nullam porttitor lacus at turpis donec posuere metus vitae ipsum aliquam non mauris|399
355|5|lobortis convallis tortor risus dapibus augue vel accumsan tellus nisi eu orci mauris lacinia sapien quis libero nullam sit amet|958
356|5|iaculis diam erat fermentum justo nec condimentum neque sapien placerat ante nulla justo aliquam quis turpis eget elit sodales|997
357|5|nisl duis ac nibh fusce lacus purus aliquet at feugiat non pretium quis lectus|863
358|5|libero ut massa volutpat convallis morbi odio odio elementum eu interdum eu|467
359|4|mi pede malesuada in imperdiet et commodo vulputate justo in blandit ultrices enim lorem ipsum dolor|947
360|2|mauris laoreet ut rhoncus aliquet pulvinar sed nisl nunc rhoncus|114
361|5|montes nascetur ridiculus mus vivamus vestibulum sagittis sapien cum sociis natoque penatibus et magnis dis parturient montes nascetur ridiculus|732
362|5|primis in faucibus orci luctus et ultrices posuere cubilia curae donec pharetra magna vestibulum aliquet ultrices|321
363|3|orci luctus et ultrices posuere cubilia curae mauris viverra diam vitae quam suspendisse|892
364|1|mauris laoreet ut rhoncus aliquet pulvinar sed nisl nunc rhoncus dui vel|930
365|4|sagittis dui vel nisl duis ac nibh fusce lacus purus aliquet at feugiat non pretium|35
366|3|volutpat in congue etiam justo etiam pretium iaculis justo in hac|158
367|2|platea dictumst aliquam augue quam sollicitudin vitae consectetuer eget rutrum at lorem integer tincidunt ante vel ipsum praesent blandit lacinia|8
368|4|elementum in hac habitasse platea dictumst morbi vestibulum velit id pretium iaculis diam erat fermentum justo nec condimentum neque sapien|560
369|1|id mauris vulputate elementum nullam varius nulla facilisi cras non velit nec nisi|644
370|3|tincidunt eu felis fusce posuere felis sed lacus morbi sem mauris laoreet|228
371|5|vel ipsum praesent blandit lacinia erat vestibulum sed magna at nunc commodo placerat praesent blandit|486
372|4|maecenas ut massa quis augue luctus tincidunt nulla mollis molestie lorem quisque ut erat curabitur gravida nisi|697
373|3|lorem vitae mattis nibh ligula nec sem duis aliquam convallis nunc proin at turpis a|117
374|5|lectus in quam fringilla rhoncus mauris enim leo rhoncus sed vestibulum sit amet cursus id turpis integer aliquet|686
375|3|vestibulum ante ipsum primis in faucibus orci luctus et ultrices posuere cubilia curae duis faucibus|460
376|5|elementum ligula vehicula consequat morbi a ipsum integer a nibh in quis justo|957
377|4|iaculis congue vivamus metus arcu adipiscing molestie hendrerit at vulputate vitae|690
378|2|dolor sit amet consectetuer adipiscing elit proin risus praesent lectus vestibulum quam sapien varius ut blandit non|507
379|1|lorem id ligula suspendisse ornare consequat lectus in est risus auctor sed tristique in tempus sit amet|147
380|3|natoque penatibus et magnis dis parturient montes nascetur ridiculus mus etiam vel augue vestibulum rutrum rutrum|90
381|3|semper rutrum nulla nunc purus phasellus in felis donec semper sapien|844
382|3|non mi integer ac neque duis bibendum morbi non quam nec dui luctus rutrum nulla tellus in sagittis|336
383|3|integer ac neque duis bibendum morbi non quam nec dui luctus rutrum nulla tellus in|940
384|1|felis ut at dolor quis odio consequat varius integer ac leo pellentesque ultrices mattis odio donec vitae nisi nam ultrices|527
385|3|etiam pretium iaculis justo in hac habitasse platea dictumst etiam faucibus cursus urna|25
386|1|pede lobortis ligula sit amet eleifend pede libero quis orci nullam molestie nibh in lectus pellentesque at nulla|493
387|3|amet diam in magna bibendum imperdiet nullam orci pede venenatis non sodales sed tincidunt eu felis fusce|843
388|5|augue vestibulum ante ipsum primis in faucibus orci luctus et ultrices posuere cubilia curae donec pharetra magna vestibulum aliquet|316
389|2|hac habitasse platea dictumst morbi vestibulum velit id pretium iaculis diam erat fermentum justo nec condimentum neque|317
390|2|vel lectus in quam fringilla rhoncus mauris enim leo rhoncus|760
391|1|amet nulla quisque arcu libero rutrum ac lobortis vel dapibus at diam|540
392|5|phasellus id sapien in sapien iaculis congue vivamus metus arcu adipiscing molestie hendrerit at vulputate vitae nisl aenean|250
393|3|duis consequat dui nec nisi volutpat eleifend donec ut dolor|844
394|5|sem mauris laoreet ut rhoncus aliquet pulvinar sed nisl nunc rhoncus dui vel sem|994
395|3|in felis donec semper sapien a libero nam dui proin leo odio porttitor id consequat in consequat|972
396|3|odio in hac habitasse platea dictumst maecenas ut massa quis augue luctus tincidunt nulla mollis molestie lorem quisque ut erat|515
397|1|sed lacus morbi sem mauris laoreet ut rhoncus aliquet pulvinar sed nisl nunc|359
398|5|vestibulum eget vulputate ut ultrices vel augue vestibulum ante ipsum primis in faucibus orci luctus|297
399|5|lorem integer tincidunt ante vel ipsum praesent blandit lacinia erat vestibulum sed magna at nunc commodo placerat praesent|705
400|1|in congue etiam justo etiam pretium iaculis justo in hac habitasse platea|404
401|2|augue aliquam erat volutpat in congue etiam justo etiam pretium iaculis justo in hac habitasse platea dictumst etiam|979
402|3|mi integer ac neque duis bibendum morbi non quam nec dui luctus rutrum nulla tellus in sagittis dui|112
403|5|quam pharetra magna ac consequat metus sapien ut nunc vestibulum ante|29
404|5|in sagittis dui vel nisl duis ac nibh fusce lacus purus aliquet at feugiat non pretium quis|272
405|5|eget tincidunt eget tempus vel pede morbi porttitor lorem id ligula suspendisse ornare consequat lectus in est|653
406|5|nec molestie sed justo pellentesque viverra pede ac diam cras pellentesque volutpat dui maecenas tristique est et tempus semper|136
407|3|ut suscipit a feugiat et eros vestibulum ac est lacinia nisi venenatis tristique fusce congue|692
408|4|lectus vestibulum quam sapien varius ut blandit non interdum in ante vestibulum ante ipsum primis in|145
409|5|aenean sit amet justo morbi ut odio cras mi pede malesuada in imperdiet et commodo vulputate|637
410|2|nulla elit ac nulla sed vel enim sit amet nunc viverra dapibus|402
411|2|orci luctus et ultrices posuere cubilia curae donec pharetra magna|290
412|1|pharetra magna ac consequat metus sapien ut nunc vestibulum ante|585
413|2|in est risus auctor sed tristique in tempus sit amet sem fusce consequat nulla nisl nunc nisl duis|449
414|5|morbi sem mauris laoreet ut rhoncus aliquet pulvinar sed nisl nunc rhoncus|336
415|5|condimentum neque sapien placerat ante nulla justo aliquam quis turpis eget elit sodales scelerisque mauris sit amet eros suspendisse|131
416|3|nullam molestie nibh in lectus pellentesque at nulla suspendisse potenti cras in purus eu magna vulputate luctus cum sociis|844
417|3|curabitur gravida nisi at nibh in hac habitasse platea dictumst aliquam augue quam sollicitudin|125
418|5|aenean lectus pellentesque eget nunc donec quis orci eget orci|496
419|5|magna at nunc commodo placerat praesent blandit nam nulla integer pede justo lacinia eget tincidunt eget tempus vel pede morbi|121
420|1|maecenas rhoncus aliquam lacus morbi quis tortor id nulla ultrices aliquet maecenas leo odio condimentum|916
421|4|consequat dui nec nisi volutpat eleifend donec ut dolor morbi vel lectus in quam fringilla rhoncus mauris enim|643
422|1|ante ipsum primis in faucibus orci luctus et ultrices posuere cubilia curae|606
423|5|sit amet eros suspendisse accumsan tortor quis turpis sed ante vivamus tortor duis mattis egestas metus aenean fermentum donec ut|778
424|3|integer non velit donec diam neque vestibulum eget vulputate ut ultrices vel augue vestibulum ante ipsum primis|81
425|3|praesent lectus vestibulum quam sapien varius ut blandit non interdum in ante|17
426|2|tempus vivamus in felis eu sapien cursus vestibulum proin eu mi nulla ac|394
427|1|magnis dis parturient montes nascetur ridiculus mus etiam vel augue vestibulum|667
428|5|velit vivamus vel nulla eget eros elementum pellentesque quisque porta|347
429|1|rutrum nulla nunc purus phasellus in felis donec semper sapien a libero nam dui|642
430|3|rhoncus aliquam lacus morbi quis tortor id nulla ultrices aliquet maecenas|779
431|4|at turpis a pede posuere nonummy integer non velit donec diam neque vestibulum eget vulputate ut ultrices vel augue vestibulum|802
432|3|in quis justo maecenas rhoncus aliquam lacus morbi quis tortor id nulla ultrices aliquet maecenas leo odio condimentum id|129
433|2|sed accumsan felis ut at dolor quis odio consequat varius integer ac leo pellentesque ultrices mattis odio donec vitae|267
434|3|at feugiat non pretium quis lectus suspendisse potenti in eleifend quam a odio in|37
435|5|justo etiam pretium iaculis justo in hac habitasse platea dictumst etiam faucibus cursus urna ut tellus nulla ut|835
436|2|suspendisse potenti nullam porttitor lacus at turpis donec posuere metus vitae ipsum|971
437|2|suspendisse potenti in eleifend quam a odio in hac habitasse platea dictumst|319
438|3|sit amet sapien dignissim vestibulum vestibulum ante ipsum primis in faucibus orci luctus et ultrices posuere cubilia curae|967
439|3|vestibulum aliquet ultrices erat tortor sollicitudin mi sit amet lobortis sapien sapien non mi integer ac neque duis|244
440|1|dolor vel est donec odio justo sollicitudin ut suscipit a feugiat et eros vestibulum|423
441|4|id turpis integer aliquet massa id lobortis convallis tortor risus dapibus augue vel|534
442|3|ut massa volutpat convallis morbi odio odio elementum eu interdum eu tincidunt in leo maecenas pulvinar lobortis est phasellus sit|695
443|2|imperdiet sapien urna pretium nisl ut volutpat sapien arcu sed augue aliquam erat volutpat|475
444|5|tincidunt eu felis fusce posuere felis sed lacus morbi sem|770
445|5|vestibulum proin eu mi nulla ac enim in tempor turpis nec euismod scelerisque quam turpis|963
446|3|vel nulla eget eros elementum pellentesque quisque porta volutpat erat quisque erat eros viverra|908
447|3|ac nulla sed vel enim sit amet nunc viverra dapibus nulla suscipit ligula|31
448|5|arcu adipiscing molestie hendrerit at vulputate vitae nisl aenean lectus pellentesque eget nunc donec quis orci eget orci vehicula condimentum|913
449|1|curabitur gravida nisi at nibh in hac habitasse platea dictumst aliquam augue quam sollicitudin vitae consectetuer eget rutrum|529
450|1|vel enim sit amet nunc viverra dapibus nulla suscipit ligula in|9
451|5|montes nascetur ridiculus mus etiam vel augue vestibulum rutrum rutrum neque aenean auctor gravida sem|431
452|4|sit amet consectetuer adipiscing elit proin interdum mauris non ligula pellentesque ultrices phasellus id sapien in sapien iaculis congue|281
453|5|justo in blandit ultrices enim lorem ipsum dolor sit amet consectetuer adipiscing elit proin|891
454|3|luctus nec molestie sed justo pellentesque viverra pede ac diam cras pellentesque volutpat dui maecenas tristique est|3
455|1|pede malesuada in imperdiet et commodo vulputate justo in blandit|119
456|3|pede ullamcorper augue a suscipit nulla elit ac nulla sed vel enim sit amet nunc viverra dapibus nulla suscipit|251
457|3|feugiat et eros vestibulum ac est lacinia nisi venenatis tristique fusce congue diam|505
458|4|consequat nulla nisl nunc nisl duis bibendum felis sed interdum venenatis turpis enim blandit mi|929
459|1|sapien sapien non mi integer ac neque duis bibendum morbi non quam|453
460|5|potenti nullam porttitor lacus at turpis donec posuere metus vitae ipsum aliquam non mauris morbi|560
461|4|proin risus praesent lectus vestibulum quam sapien varius ut blandit non interdum in ante vestibulum ante ipsum primis|949
462|4|nisi at nibh in hac habitasse platea dictumst aliquam augue quam sollicitudin vitae consectetuer eget rutrum|280
463|5|consectetuer eget rutrum at lorem integer tincidunt ante vel ipsum praesent blandit lacinia erat vestibulum sed magna|20
464|2|morbi sem mauris laoreet ut rhoncus aliquet pulvinar sed nisl nunc rhoncus dui vel sem|601
465|4|nunc purus phasellus in felis donec semper sapien a libero nam dui proin leo|967
466|1|cum sociis natoque penatibus et magnis dis parturient montes nascetur ridiculus mus vivamus vestibulum sagittis|452
467|3|erat volutpat in congue etiam justo etiam pretium iaculis justo in hac habitasse platea dictumst etiam faucibus cursus urna ut|197
468|3|vestibulum ante ipsum primis in faucibus orci luctus et ultrices posuere cubilia curae duis faucibus accumsan odio curabitur|649
469|5|ut volutpat sapien arcu sed augue aliquam erat volutpat in congue etiam justo etiam pretium iaculis justo in hac habitasse|217
470|4|dolor quis odio consequat varius integer ac leo pellentesque ultrices mattis odio donec vitae|166
471|1|nisl venenatis lacinia aenean sit amet justo morbi ut odio cras mi pede malesuada in|22
472|3|vel sem sed sagittis nam congue risus semper porta volutpat|255
473|4|ornare imperdiet sapien urna pretium nisl ut volutpat sapien arcu sed augue aliquam erat volutpat in congue etiam|820
474|1|eros elementum pellentesque quisque porta volutpat erat quisque erat eros viverra eget congue eget semper rutrum nulla nunc purus|204
475|5|augue vestibulum rutrum rutrum neque aenean auctor gravida sem praesent id massa id|18
476|2|justo lacinia eget tincidunt eget tempus vel pede morbi porttitor lorem id ligula suspendisse ornare consequat lectus in est|372
477|5|nibh ligula nec sem duis aliquam convallis nunc proin at turpis a pede posuere nonummy integer non|476
478|2|odio curabitur convallis duis consequat dui nec nisi volutpat eleifend donec ut dolor morbi vel lectus|987
479|4|ante ipsum primis in faucibus orci luctus et ultrices posuere cubilia curae nulla dapibus dolor|162
480|5|in lacus curabitur at ipsum ac tellus semper interdum mauris ullamcorper purus sit amet nulla quisque arcu libero rutrum|128
481|4|amet consectetuer adipiscing elit proin risus praesent lectus vestibulum quam sapien varius ut blandit non interdum in ante vestibulum ante|502
482|5|sollicitudin vitae consectetuer eget rutrum at lorem integer tincidunt ante vel ipsum praesent blandit lacinia erat vestibulum sed|843
483|2|rhoncus mauris enim leo rhoncus sed vestibulum sit amet cursus id turpis integer aliquet massa id lobortis|434
484|5|justo lacinia eget tincidunt eget tempus vel pede morbi porttitor lorem|985
