id|score|comment|bookId
485|1|lectus vestibulum quam sapien varius ut blandit non interdum in|289
486|4|vitae nisl aenean lectus pellentesque eget nunc donec quis orci eget orci vehicula condimentum|929
487|3|condimentum neque sapien placerat ante nulla justo aliquam quis turpis eget elit sodales scelerisque mauris sit|249
488|1|erat fermentum justo nec condimentum neque sapien placerat ante nulla justo aliquam quis|234
489|2|vel lectus in quam fringilla rhoncus mauris enim leo rhoncus sed vestibulum sit amet cursus id turpis integer|133
490|4|maecenas rhoncus aliquam lacus morbi quis tortor id nulla ultrices aliquet maecenas leo odio|323
491|3|turpis adipiscing lorem vitae mattis nibh ligula nec sem duis aliquam convallis nunc|376
492|5|porttitor lacus at turpis donec posuere metus vitae ipsum aliquam non|823
493|1|nisi vulputate nonummy maecenas tincidunt lacus at velit vivamus vel nulla eget eros elementum pellentesque quisque porta volutpat|203
494|4|vitae mattis nibh ligula nec sem duis aliquam convallis nunc proin at turpis a pede posuere nonummy integer non velit|975
495|3|quam a odio in hac habitasse platea dictumst maecenas ut massa quis augue luctus tincidunt nulla mollis|417
496|3|interdum venenatis turpis enim blandit mi in porttitor pede justo eu massa donec dapibus duis at velit eu est|384
497|1|nulla neque libero convallis eget eleifend luctus ultricies eu nibh quisque id justo|659
498|1|cubilia curae donec pharetra magna vestibulum aliquet ultrices erat tortor sollicitudin|708
499|2|sagittis nam congue risus semper porta volutpat quam pede lobortis ligula sit amet|923
500|2|commodo placerat praesent blandit nam nulla integer pede justo lacinia|104
501|3|rhoncus aliquam lacus morbi quis tortor id nulla ultrices aliquet maecenas leo odio|763
502|2|quis turpis sed ante vivamus tortor duis mattis egestas metus aenean fermentum|224
503|5|quam pede lobortis ligula sit amet eleifend pede libero quis orci nullam|35
504|2|nullam molestie nibh in lectus pellentesque at nulla suspendisse potenti|355
505|2|sit amet consectetuer adipiscing elit proin interdum mauris non ligula pellentesque ultrices phasellus id sapien in sapien iaculis|259
506|1|consequat ut nulla sed accumsan felis ut at dolor quis odio consequat varius integer ac leo pellentesque ultrices|196
507|5|vitae consectetuer eget rutrum at lorem integer tincidunt ante vel ipsum praesent blandit|697
508|5|dignissim vestibulum vestibulum ante ipsum primis in faucibus orci luctus et ultrices posuere cubilia curae nulla dapibus dolor vel|900
509|1|nulla justo aliquam quis turpis eget elit sodales scelerisque mauris sit amet eros suspendisse accumsan tortor quis turpis sed|105
510|5|eleifend pede libero quis orci nullam molestie nibh in lectus pellentesque at nulla suspendisse|342
511|4|neque sapien placerat ante nulla justo aliquam quis turpis eget elit sodales scelerisque mauris sit|768
512|1|dolor sit amet consectetuer adipiscing elit proin interdum mauris non ligula pellentesque ultrices phasellus id sapien in sapien|436
513|3|mauris vulputate elementum nullam varius nulla facilisi cras non velit nec nisi|838
514|3|dui vel nisl duis ac nibh fusce lacus purus aliquet at feugiat non pretium quis lectus suspendisse potenti|903
515|1|leo maecenas pulvinar lobortis est phasellus sit amet erat nulla tempus vivamus in felis|435
516|1|proin leo odio porttitor id consequat in consequat ut nulla sed accumsan felis ut at dolor quis|190
517|1|aliquet ultrices erat tortor sollicitudin mi sit amet lobortis sapien sapien non mi integer ac neque|509
518|1|quam pharetra magna ac consequat metus sapien ut nunc vestibulum ante ipsum primis in faucibus|46
519|2|in congue etiam justo etiam pretium iaculis justo in hac habitasse platea dictumst|197
520|2|integer a nibh in quis justo maecenas rhoncus aliquam lacus morbi quis tortor id nulla ultrices aliquet maecenas leo|914
521|3|vitae nisi nam ultrices libero non mattis pulvinar nulla pede|769
522|2|arcu adipiscing molestie hendrerit at vulputate vitae nisl aenean lectus pellentesque eget nunc donec quis orci eget orci vehicula|219
523|5|in faucibus orci luctus et ultrices posuere cubilia curae donec|78
524|2|venenatis tristique fusce congue diam id ornare imperdiet sapien urna pretium|762
525|5|mauris morbi non lectus aliquam sit amet diam in magna bibendum imperdiet nullam orci pede venenatis non sodales sed tincidunt|897
526|1|montes nascetur ridiculus mus vivamus vestibulum sagittis sapien cum sociis natoque|643
527|3|ipsum integer a nibh in quis justo maecenas rhoncus aliquam lacus morbi quis tortor|287
528|2|dictumst aliquam augue quam sollicitudin vitae consectetuer eget rutrum at lorem integer tincidunt ante|761
529|2|quis lectus suspendisse potenti in eleifend quam a odio in|467
530|1|volutpat quam pede lobortis ligula sit amet eleifend pede libero quis orci nullam molestie nibh in lectus|935
531|2|faucibus orci luctus et ultrices posuere cubilia curae mauris viverra diam vitae quam|673
532|1|eget elit sodales scelerisque mauris sit amet eros suspendisse accumsan tortor quis turpis sed ante vivamus tortor|513
533|4|vestibulum eget vulputate ut ultrices vel augue vestibulum ante ipsum primis in faucibus orci luctus et ultrices|88
534|1|justo maecenas rhoncus aliquam lacus morbi quis tortor id nulla ultrices aliquet maecenas leo|168
535|3|sed vestibulum sit amet cursus id turpis integer aliquet massa id lobortis convallis tortor risus dapibus augue vel|257
536|4|donec ut mauris eget massa tempor convallis nulla neque libero convallis eget eleifend|841
537|2|id lobortis convallis tortor risus dapibus augue vel accumsan tellus nisi eu orci mauris|939
538|5|primis in faucibus orci luctus et ultrices posuere cubilia curae donec pharetra magna vestibulum aliquet ultrices erat|793
539|1|nullam molestie nibh in lectus pellentesque at nulla suspendisse potenti|106
540|3|praesent blandit nam nulla integer pede justo lacinia eget tincidunt eget tempus vel|181
541|5|sit amet erat nulla tempus vivamus in felis eu sapien cursus vestibulum proin eu|961
542|1|donec diam neque vestibulum eget vulputate ut ultrices vel augue vestibulum|187
543|3|pede libero quis orci nullam molestie nibh in lectus pellentesque at|352
544|3|justo morbi ut odio cras mi pede malesuada in imperdiet et commodo vulputate|316
545|5|consequat lectus in est risus auctor sed tristique in tempus sit amet|540
546|2|nibh in quis justo maecenas rhoncus aliquam lacus morbi quis tortor id nulla ultrices|576
547|2|massa tempor convallis nulla neque libero convallis eget eleifend luctus ultricies eu|275
548|5|blandit lacinia erat vestibulum sed magna at nunc commodo placerat praesent blandit nam nulla|693
549|5|sit amet nunc viverra dapibus nulla suscipit ligula in lacus curabitur at ipsum ac tellus semper interdum mauris ullamcorper|702
550|5|at vulputate vitae nisl aenean lectus pellentesque eget nunc donec quis|161
551|4|ut blandit non interdum in ante vestibulum ante ipsum primis|258
552|2|aliquet pulvinar sed nisl nunc rhoncus dui vel sem sed sagittis nam congue risus|6
553|5|bibendum felis sed interdum venenatis turpis enim blandit mi in porttitor pede justo eu massa donec|417
554|5|proin eu mi nulla ac enim in tempor turpis nec euismod scelerisque quam turpis adipiscing|806
555|3|at velit eu est congue elementum in hac habitasse platea dictumst morbi|649
556|1|quisque porta volutpat erat quisque erat eros viverra eget congue eget semper rutrum nulla nunc purus phasellus|20
557|2|mollis molestie lorem quisque ut erat curabitur gravida nisi at nibh in hac|966
558|4|mauris sit amet eros suspendisse accumsan tortor quis turpis sed ante vivamus tortor duis mattis egestas metus aenean fermentum donec|516
559|2|nulla ultrices aliquet maecenas leo odio condimentum id luctus nec molestie sed justo pellentesque viverra pede ac diam cras pellentesque|420
560|3|platea dictumst maecenas ut massa quis augue luctus tincidunt nulla mollis molestie lorem quisque ut|914
561|1|libero quis orci nullam molestie nibh in lectus pellentesque at nulla|10
562|3|dis parturient montes nascetur ridiculus mus etiam vel augue vestibulum rutrum|859
563|4|praesent blandit nam nulla integer pede justo lacinia eget tincidunt eget tempus vel pede morbi porttitor|136
564|4|id turpis integer aliquet massa id lobortis convallis tortor risus dapibus|681
565|5|sit amet nunc viverra dapibus nulla suscipit ligula in lacus curabitur at ipsum ac tellus semper interdum mauris ullamcorper purus|44
566|3|vel nisl duis ac nibh fusce lacus purus aliquet at feugiat non pretium quis lectus suspendisse potenti in|240
567|4|mauris enim leo rhoncus sed vestibulum sit amet cursus id|452
568|1|tellus semper interdum mauris ullamcorper purus sit amet nulla quisque arcu libero rutrum ac lobortis|498
569|4|posuere nonummy integer non velit donec diam neque vestibulum eget vulputate ut ultrices vel augue vestibulum ante ipsum primis|577
570|1|placerat ante nulla justo aliquam quis turpis eget elit sodales scelerisque mauris sit|199
571|4|quisque porta volutpat erat quisque erat eros viverra eget congue eget semper rutrum nulla nunc purus phasellus|68
572|4|interdum mauris non ligula pellentesque ultrices phasellus id sapien in sapien iaculis congue vivamus metus|118
573|4|nulla suspendisse potenti cras in purus eu magna vulputate luctus cum sociis natoque penatibus et magnis dis parturient montes nascetur|920
574|4|duis at velit eu est congue elementum in hac habitasse platea dictumst morbi vestibulum velit id pretium iaculis diam erat|885
575|2|semper interdum mauris ullamcorper purus sit amet nulla quisque arcu libero rutrum ac lobortis vel|664
576|2|condimentum curabitur in libero ut massa volutpat convallis morbi odio odio elementum|191
577|3|nibh in lectus pellentesque at nulla suspendisse potenti cras in purus eu magna vulputate|888
578|4|pulvinar sed nisl nunc rhoncus dui vel sem sed sagittis|606
579|2|porttitor lacus at turpis donec posuere metus vitae ipsum aliquam non mauris morbi non lectus aliquam|932
580|1|et ultrices posuere cubilia curae duis faucibus accumsan odio curabitur convallis duis consequat|531
581|1|tempus semper est quam pharetra magna ac consequat metus sapien ut nunc vestibulum ante ipsum primis in faucibus|205
582|3|convallis duis consequat dui nec nisi volutpat eleifend donec ut dolor morbi vel lectus in quam fringilla rhoncus|954
583|1|risus praesent lectus vestibulum quam sapien varius ut blandit non interdum in ante vestibulum ante|306
584|1|amet turpis elementum ligula vehicula consequat morbi a ipsum integer a nibh in quis justo maecenas|665
585|1|amet eleifend pede libero quis orci nullam molestie nibh in lectus pellentesque at|338
586|1|nulla justo aliquam quis turpis eget elit sodales scelerisque mauris|254
587|4|rhoncus mauris enim leo rhoncus sed vestibulum sit amet cursus id turpis integer aliquet massa id lobortis convallis tortor risus|333
588|5|vitae nisl aenean lectus pellentesque eget nunc donec quis orci eget orci vehicula|583
589|3|habitasse platea dictumst aliquam augue quam sollicitudin vitae consectetuer eget rutrum at lorem integer tincidunt ante vel|467
590|4|orci luctus et ultrices posuere cubilia curae mauris viverra diam vitae quam suspendisse|506
591|4|lectus suspendisse potenti in eleifend quam a odio in hac habitasse platea dictumst maecenas ut massa quis|843
592|2|lectus pellentesque at nulla suspendisse potenti cras in purus eu magna vulputate luctus cum sociis natoque penatibus et magnis|60
593|4|at velit eu est congue elementum in hac habitasse platea dictumst morbi vestibulum velit id pretium iaculis diam|865
594|2|vulputate luctus cum sociis natoque penatibus et magnis dis parturient montes nascetur ridiculus mus|947
595|2|cras pellentesque volutpat dui maecenas tristique est et tempus semper est quam pharetra magna ac consequat metus sapien|516
596|1|congue eget semper rutrum nulla nunc purus phasellus in felis donec semper sapien|785
597|4|velit id pretium iaculis diam erat fermentum justo nec condimentum neque sapien placerat ante nulla|356
598|3|vehicula consequat morbi a ipsum integer a nibh in quis justo maecenas rhoncus aliquam lacus morbi quis tortor id|967
599|1|amet eleifend pede libero quis orci nullam molestie nibh in lectus pellentesque at nulla suspendisse potenti cras|505
600|5|elit proin risus praesent lectus vestibulum quam sapien varius ut blandit non interdum in ante vestibulum ante ipsum primis|522
601|5|lectus pellentesque eget nunc donec quis orci eget orci vehicula condimentum curabitur in|916
602|4|vestibulum sit amet cursus id turpis integer aliquet massa id lobortis convallis tortor risus dapibus|232
603|3|curabitur in libero ut massa volutpat convallis morbi odio odio elementum eu interdum eu|181
604|2|fusce lacus purus aliquet at feugiat non pretium quis lectus suspendisse potenti in eleifend quam a odio|386
605|2|in ante vestibulum ante ipsum primis in faucibus orci luctus et ultrices posuere cubilia|193
606|2|semper sapien a libero nam dui proin leo odio porttitor id consequat|87
607|4|erat curabitur gravida nisi at nibh in hac habitasse platea dictumst aliquam augue quam sollicitudin vitae|546
608|5|dapibus augue vel accumsan tellus nisi eu orci mauris lacinia|546
609|3|adipiscing molestie hendrerit at vulputate vitae nisl aenean lectus pellentesque eget nunc donec quis orci eget orci|462
610|2|justo aliquam quis turpis eget elit sodales scelerisque mauris sit amet eros suspendisse accumsan tortor quis turpis sed|511
611|3|dolor quis odio consequat varius integer ac leo pellentesque ultrices mattis odio donec|743
612|5|amet consectetuer adipiscing elit proin interdum mauris non ligula pellentesque ultrices phasellus id sapien in|93
613|5|neque sapien placerat ante nulla justo aliquam quis turpis eget elit sodales scelerisque mauris sit amet eros|738
614|3|blandit mi in porttitor pede justo eu massa donec dapibus duis at velit eu est congue elementum in hac|606
615|3|ipsum dolor sit amet consectetuer adipiscing elit proin risus praesent lectus vestibulum quam sapien varius ut blandit non|218
616|5|est donec odio justo sollicitudin ut suscipit a feugiat et eros vestibulum ac est lacinia nisi venenatis tristique fusce|53
617|5|donec diam neque vestibulum eget vulputate ut ultrices vel augue vestibulum ante ipsum primis in faucibus orci luctus et ultrices|670
618|4|vel lectus in quam fringilla rhoncus mauris enim leo rhoncus sed vestibulum sit amet cursus id turpis integer|952
619|4|turpis donec posuere metus vitae ipsum aliquam non mauris morbi non|158
620|1|lectus pellentesque eget nunc donec quis orci eget orci vehicula condimentum curabitur in|496
621|4|ut blandit non interdum in ante vestibulum ante ipsum primis in faucibus orci luctus et|40
622|1|luctus cum sociis natoque penatibus et magnis dis parturient montes nascetur ridiculus mus|766
623|1|mi in porttitor pede justo eu massa donec dapibus duis|901
624|4|mi in porttitor pede justo eu massa donec dapibus duis at velit eu est congue elementum in hac|584
625|5|at dolor quis odio consequat varius integer ac leo pellentesque|617
626|2|pellentesque quisque porta volutpat erat quisque erat eros viverra eget congue eget semper rutrum nulla|626
627|2|sem sed sagittis nam congue risus semper porta volutpat quam pede lobortis ligula sit amet|587
628|1|libero quis orci nullam molestie nibh in lectus pellentesque at nulla suspendisse potenti cras in purus|601
629|2|mi integer ac neque duis bibendum morbi non quam nec dui luctus rutrum nulla tellus in sagittis dui vel|644
630|3|erat nulla tempus vivamus in felis eu sapien cursus vestibulum proin eu mi nulla ac enim in tempor turpis nec|825
631|2|donec semper sapien a libero nam dui proin leo odio porttitor id consequat in consequat ut nulla|855
632|4|tellus in sagittis dui vel nisl duis ac nibh fusce lacus purus aliquet at feugiat non pretium|56
633|4|morbi quis tortor id nulla ultrices aliquet maecenas leo odio condimentum id luctus nec molestie sed justo pellentesque viverra pede|225
634|1|enim blandit mi in porttitor pede justo eu massa donec dapibus duis at velit eu|982
635|3|at ipsum ac tellus semper interdum mauris ullamcorper purus sit amet nulla quisque arcu libero rutrum ac lobortis vel|514
636|3|consequat varius integer ac leo pellentesque ultrices mattis odio donec vitae nisi nam ultrices libero non mattis|217
637|3|diam neque vestibulum eget vulputate ut ultrices vel augue vestibulum ante ipsum primis|135
638|1|metus vitae ipsum aliquam non mauris morbi non lectus aliquam sit amet diam in magna bibendum|340
639|3|odio condimentum id luctus nec molestie sed justo pellentesque viverra pede ac diam cras pellentesque volutpat dui|587
640|3|nulla tellus in sagittis dui vel nisl duis ac nibh fusce lacus purus aliquet at feugiat non|219
641|5|donec dapibus duis at velit eu est congue elementum in hac habitasse|998
642|1|ante nulla justo aliquam quis turpis eget elit sodales scelerisque mauris sit|453
643|1|sapien cursus vestibulum proin eu mi nulla ac enim in tempor turpis nec|310
644|5|dapibus duis at velit eu est congue elementum in hac habitasse platea dictumst morbi vestibulum velit id pretium iaculis|619
645|1|diam in magna bibendum imperdiet nullam orci pede venenatis non sodales sed tincidunt eu felis fusce posuere felis sed|529
646|2|nulla tempus vivamus in felis eu sapien cursus vestibulum proin eu mi nulla ac enim in tempor|854
647|2|vestibulum velit id pretium iaculis diam erat fermentum justo nec condimentum neque sapien placerat|265
648|3|et magnis dis parturient montes nascetur ridiculus mus etiam vel augue vestibulum rutrum rutrum neque aenean auctor gravida|68
649|4|congue eget semper rutrum nulla nunc purus phasellus in felis donec semper sapien a libero nam|596
650|2|convallis morbi odio odio elementum eu interdum eu tincidunt in leo maecenas pulvinar lobortis est|705
651|1|semper porta volutpat quam pede lobortis ligula sit amet eleifend pede libero quis orci nullam|334
652|2|euismod scelerisque quam turpis adipiscing lorem vitae mattis nibh ligula nec sem duis aliquam|403
653|3|ullamcorper augue a suscipit nulla elit ac nulla sed vel enim sit amet nunc viverra|756
654|1|erat vestibulum sed magna at nunc commodo placerat praesent blandit nam nulla integer pede|674
655|1|elementum nullam varius nulla facilisi cras non velit nec nisi vulputate nonummy maecenas tincidunt lacus at velit vivamus vel nulla|809
656|4|aenean lectus pellentesque eget nunc donec quis orci eget orci vehicula condimentum curabitur in libero ut massa volutpat convallis morbi|375
657|2|duis bibendum morbi non quam nec dui luctus rutrum nulla|563
658|1|sapien sapien non mi integer ac neque duis bibendum morbi non|91
659|4|dolor quis odio consequat varius integer ac leo pellentesque ultrices mattis odio donec vitae|136
660|5|in libero ut massa volutpat convallis morbi odio odio elementum eu interdum|699
661|2|nunc vestibulum ante ipsum primis in faucibus orci luctus et ultrices posuere cubilia curae mauris viverra diam|695
662|5|ullamcorper purus sit amet nulla quisque arcu libero rutrum ac lobortis vel dapibus|218
663|3|augue luctus tincidunt nulla mollis molestie lorem quisque ut erat curabitur gravida nisi at nibh in|59
664|5|lacus morbi sem mauris laoreet ut rhoncus aliquet pulvinar sed nisl nunc rhoncus dui vel sem|268
665|5|curabitur at ipsum ac tellus semper interdum mauris ullamcorper purus sit amet nulla quisque arcu libero rutrum ac lobortis|244
666|5|aliquam augue quam sollicitudin vitae consectetuer eget rutrum at lorem integer tincidunt ante vel ipsum praesent blandit lacinia|914
667|3|nulla integer pede justo lacinia eget tincidunt eget tempus vel pede morbi porttitor lorem id ligula suspendisse ornare consequat|267
668|5|justo pellentesque viverra pede ac diam cras pellentesque volutpat dui maecenas|38
669|4|ullamcorper purus sit amet nulla quisque arcu libero rutrum ac lobortis vel dapibus at diam nam tristique tortor eu pede|131
670|3|quam a odio in hac habitasse platea dictumst maecenas ut massa quis augue luctus tincidunt nulla mollis|329
671|2|non mi integer ac neque duis bibendum morbi non quam nec dui luctus|337
672|2|diam neque vestibulum eget vulputate ut ultrices vel augue vestibulum ante ipsum primis in faucibus orci luctus et|196
673|3|adipiscing elit proin risus praesent lectus vestibulum quam sapien varius ut blandit non interdum in ante|728
674|4|interdum eu tincidunt in leo maecenas pulvinar lobortis est phasellus sit amet erat|456
675|4|duis at velit eu est congue elementum in hac habitasse platea dictumst morbi vestibulum velit|602
676|3|quam fringilla rhoncus mauris enim leo rhoncus sed vestibulum sit amet cursus id turpis integer aliquet|120
677|5|montes nascetur ridiculus mus etiam vel augue vestibulum rutrum rutrum neque aenean auctor gravida sem praesent|923
678|2|sed nisl nunc rhoncus dui vel sem sed sagittis nam congue risus semper porta volutpat quam pede|457
679|5|aliquam augue quam sollicitudin vitae consectetuer eget rutrum at lorem|44
680|1|duis at velit eu est congue elementum in hac habitasse platea dictumst|139
681|3|in magna bibendum imperdiet nullam orci pede venenatis non sodales sed tincidunt eu|690
682|2|orci luctus et ultrices posuere cubilia curae nulla dapibus dolor vel est donec odio justo|777
683|4|turpis adipiscing lorem vitae mattis nibh ligula nec sem duis aliquam convallis nunc proin at turpis a pede|118
684|2|in leo maecenas pulvinar lobortis est phasellus sit amet erat nulla|275
685|1|magna ac consequat metus sapien ut nunc vestibulum ante ipsum primis in faucibus orci luctus et ultrices posuere cubilia|392
686|4|vestibulum sit amet cursus id turpis integer aliquet massa id lobortis convallis tortor risus dapibus augue vel accumsan|614
687|3|vestibulum quam sapien varius ut blandit non interdum in ante vestibulum ante ipsum primis in faucibus orci luctus et|183
688|3|vel ipsum praesent blandit lacinia erat vestibulum sed magna at nunc commodo placerat praesent blandit nam nulla|85
689|5|sit amet erat nulla tempus vivamus in felis eu sapien cursus vestibulum proin|476
690|5|at velit vivamus vel nulla eget eros elementum pellentesque quisque porta volutpat erat quisque erat eros viverra eget congue|328
691|3|ante nulla justo aliquam quis turpis eget elit sodales scelerisque mauris sit amet eros suspendisse accumsan tortor|743
692|3|platea dictumst maecenas ut massa quis augue luctus tincidunt nulla mollis molestie lorem quisque ut erat curabitur gravida|569
693|3|nisl duis ac nibh fusce lacus purus aliquet at feugiat non pretium quis lectus suspendisse potenti in eleifend quam a|338
694|1|adipiscing molestie hendrerit at vulputate vitae nisl aenean lectus pellentesque|841
695|4|tempus semper est quam pharetra magna ac consequat metus sapien ut|598
696|1|quam suspendisse potenti nullam porttitor lacus at turpis donec posuere metus vitae ipsum aliquam non|744
697|2|eu magna vulputate luctus cum sociis natoque penatibus et magnis dis parturient montes nascetur ridiculus mus vivamus vestibulum|530
698|5|ultrices posuere cubilia curae mauris viverra diam vitae quam suspendisse potenti nullam|561
699|1|sit amet sapien dignissim vestibulum vestibulum ante ipsum primis in faucibus orci luctus et ultrices posuere cubilia curae nulla|817
700|5|mollis molestie lorem quisque ut erat curabitur gravida nisi at nibh in hac habitasse platea dictumst|983
701|5|in sagittis dui vel nisl duis ac nibh fusce lacus purus aliquet at feugiat non pretium quis lectus suspendisse potenti|187
702|4|suspendisse potenti cras in purus eu magna vulputate luctus cum sociis natoque|720
703|5|rutrum at lorem integer tincidunt ante vel ipsum praesent blandit|19
704|4|vel pede morbi porttitor lorem id ligula suspendisse ornare consequat lectus in est risus|280
705|3|lobortis ligula sit amet eleifend pede libero quis orci nullam molestie nibh|906
706|4|sapien urna pretium nisl ut volutpat sapien arcu sed augue aliquam erat volutpat in congue etiam justo|221
707|3|nibh in hac habitasse platea dictumst aliquam augue quam sollicitudin vitae consectetuer eget rutrum at|231
708|4|justo nec condimentum neque sapien placerat ante nulla justo aliquam quis turpis eget elit sodales scelerisque mauris sit amet|409
709|5|ligula vehicula consequat morbi a ipsum integer a nibh in quis justo maecenas rhoncus aliquam lacus|395
710|2|in tempor turpis nec euismod scelerisque quam turpis adipiscing lorem vitae mattis nibh|201
711|4|ante ipsum primis in faucibus orci luctus et ultrices posuere cubilia curae mauris viverra diam vitae quam suspendisse potenti|402
712|2|sed magna at nunc commodo placerat praesent blandit nam nulla integer pede justo lacinia eget tincidunt eget tempus|355
713|3|erat curabitur gravida nisi at nibh in hac habitasse platea|6
714|5|aliquam lacus morbi quis tortor id nulla ultrices aliquet maecenas leo odio condimentum id luctus nec molestie|566
715|1|suspendisse potenti cras in purus eu magna vulputate luctus cum sociis natoque penatibus et magnis dis parturient montes nascetur ridiculus|48
716|2|amet justo morbi ut odio cras mi pede malesuada in imperdiet et commodo vulputate justo|873
717|3|lobortis est phasellus sit amet erat nulla tempus vivamus in felis eu sapien cursus vestibulum proin|20
718|4|purus aliquet at feugiat non pretium quis lectus suspendisse potenti in eleifend quam a odio in hac habitasse platea dictumst|27
719|3|sit amet erat nulla tempus vivamus in felis eu sapien cursus vestibulum proin eu mi nulla|827
720|2|mauris laoreet ut rhoncus aliquet pulvinar sed nisl nunc rhoncus dui vel sem sed sagittis nam congue risus semper porta|225
721|4|sit amet turpis elementum ligula vehicula consequat morbi a ipsum integer a nibh in|736
722|5|rhoncus dui vel sem sed sagittis nam congue risus semper porta volutpat quam pede lobortis ligula sit amet eleifend pede|108
723|1|ipsum ac tellus semper interdum mauris ullamcorper purus sit amet nulla quisque arcu libero rutrum ac lobortis vel dapibus at|613
